{
  "schemaVersion": 1,
  "harnessCommit": "407ece8a532bdec026fca808097540eff10aefe3",
  "runnerId": "5b4900aecd33bd39b7e31b24",
  "commit": "88c861e3a294a249e7a8cdd7319e032d7c29fb35",
  "environment": {
    "node": "v24.19.0",
    "platform": "linux",
    "arch": "x64",
    "cpu": "AMD EPYC 9V74 80-Core Processor",
    "logicalCpus": 9,
    "osRelease": "6.18.44",
    "runnerName": "4a20ccefcfde",
    "commit": "88c861e3a294a249e7a8cdd7319e032d7c29fb35"
  },
  "benchmarks": [
    {
      "id": "A03/typed-verifier/Diamond",
      "area": "A03",
      "engine": "node-typed-verifier",
      "unit": "ms",
      "samples": [
        4.001929999999959,
        3.8653789999999617,
        3.675799999999981,
        13.14559300000002,
        3.9703630000000203,
        3.5726290000000063,
        3.609473000000037,
        3.70442300000002,
        3.3690089999999486,
        3.838179000000025,
        3.4290569999999434,
        3.4576489999999467,
        3.8188310000000456,
        3.541413000000034,
        3.9243560000001025,
        3.6209689999999455,
        3.6110650000000533,
        3.5577369999999746,
        3.2238250000000335,
        3.3616680000000088,
        3.3557799999999816,
        3.5847069999999803,
        3.346153999999956,
        3.299535999999989,
        3.568593000000078,
        3.3089800000000196,
        3.6313450000000103,
        3.5442070000000285,
        3.9105460000000676,
        3.3513830000000553,
        3.298485000000028,
        3.507592999999929,
        4.028749999999945,
        3.591295999999943,
        3.2761619999999994,
        3.441265000000044,
        3.191257000000064,
        3.212176999999997,
        3.351403000000005,
        3.563986,
        3.854103000000009,
        3.444939999999974,
        3.240648999999962,
        3.603234000000043,
        3.3374209999999493,
        3.90567800000008,
        3.229082999999946,
        3.4225170000000844,
        3.1467509999999947,
        3.4872930000000224,
        3.4851990000000796,
        3.477047999999968,
        3.3994129999999814,
        3.1986180000000104,
        3.3810770000000048,
        3.3376329999999825,
        3.141843999999992,
        4.149478000000045,
        3.1996189999999842,
        3.4432279999999764,
        3.137216999999964,
        3.158297999999945,
        3.7069660000000795,
        3.2614509999999655,
        3.6000080000000025,
        3.1227870000000166,
        3.1524899999999434,
        3.5031960000000026,
        3.1582690000000184,
        3.494393000000059,
        3.293928000000051,
        3.5737100000000055,
        3.221031000000039,
        3.461995999999999,
        3.528622999999925,
        3.2311650000000327,
        3.4673540000000003,
        3.533600999999976,
        3.732093999999961,
        3.3006880000000365,
        4.307039000000032,
        3.398871999999983,
        3.1473419999999805,
        3.4106409999999414,
        3.3004080000000613,
        3.413133000000016,
        3.5882210000000896,
        3.819101000000046,
        3.5410719999999856,
        3.1469110000000455,
        3.7203060000000505,
        3.4899970000000167,
        3.4491369999999506,
        3.4629169999999476,
        3.226908999999978,
        3.402166999999963,
        3.1221140000000105,
        3.2689510000000155,
        3.640969000000041,
        3.427644999999984
      ],
      "coldSamples": [
        16.12672600000002
      ],
      "statistics": {
        "count": 100,
        "median": 3.4533929999999486,
        "p95": 3.9703630000000203,
        "p99": 4.307039000000032,
        "min": 3.1221140000000105,
        "max": 13.14559300000002
      },
      "correctness": {
        "passed": true,
        "checksum": "ea1e14d89e8dc4db678cabe0221f2a79753e7d79bfd59be846f3459f75780dcb"
      },
      "metrics": {
        "identity": {
          "fixtureSHA256": "96dbe2c0bde4611706d7c4bf655cb4a7c07de20476bed31acd0290057aea0622",
          "expected": "verified"
        },
        "iterationsPerBatch": 1000,
        "chronological": [
          {
            "sample": 0,
            "phase": "cold",
            "ms": 16.12672600000002,
            "heapDeltaBytes": 9077728,
            "checkedInvocations": 1000
          },
          {
            "sample": 1,
            "phase": "warmup",
            "ms": 8.916072999999983,
            "heapDeltaBytes": -8103592,
            "checkedInvocations": 1000
          },
          {
            "sample": 2,
            "phase": "warmup",
            "ms": 11.05446599999999,
            "heapDeltaBytes": 8207296,
            "checkedInvocations": 1000
          },
          {
            "sample": 3,
            "phase": "warmup",
            "ms": 10.465143000000012,
            "heapDeltaBytes": 7456456,
            "checkedInvocations": 1000
          },
          {
            "sample": 4,
            "phase": "warmup",
            "ms": 5.076702000000012,
            "heapDeltaBytes": -9987768,
            "checkedInvocations": 1000
          },
          {
            "sample": 5,
            "phase": "warmup",
            "ms": 4.52579099999997,
            "heapDeltaBytes": 6656072,
            "checkedInvocations": 1000
          },
          {
            "sample": 6,
            "phase": "warmup",
            "ms": 5.2519700000000284,
            "heapDeltaBytes": -9954272,
            "checkedInvocations": 1000
          },
          {
            "sample": 7,
            "phase": "warmup",
            "ms": 4.046766000000048,
            "heapDeltaBytes": 6648728,
            "checkedInvocations": 1000
          },
          {
            "sample": 8,
            "phase": "warmup",
            "ms": 4.0458039999999755,
            "heapDeltaBytes": 6653384,
            "checkedInvocations": 1000
          },
          {
            "sample": 9,
            "phase": "warmup",
            "ms": 4.215334999999982,
            "heapDeltaBytes": -10109912,
            "checkedInvocations": 1000
          },
          {
            "sample": 10,
            "phase": "warmup",
            "ms": 4.97652400000004,
            "heapDeltaBytes": 6652848,
            "checkedInvocations": 1000
          },
          {
            "sample": 11,
            "phase": "warmup",
            "ms": 6.143651999999975,
            "heapDeltaBytes": -10032920,
            "checkedInvocations": 1000
          },
          {
            "sample": 12,
            "phase": "warmup",
            "ms": 4.474646000000007,
            "heapDeltaBytes": 6761608,
            "checkedInvocations": 1000
          },
          {
            "sample": 13,
            "phase": "warmup",
            "ms": 3.573709000000008,
            "heapDeltaBytes": 6988392,
            "checkedInvocations": 1000
          },
          {
            "sample": 14,
            "phase": "warmup",
            "ms": 5.156690000000026,
            "heapDeltaBytes": -9713640,
            "checkedInvocations": 1000
          },
          {
            "sample": 15,
            "phase": "warmup",
            "ms": 4.691295000000025,
            "heapDeltaBytes": 6988480,
            "checkedInvocations": 1000
          },
          {
            "sample": 16,
            "phase": "warmup",
            "ms": 5.301883999999973,
            "heapDeltaBytes": -9721664,
            "checkedInvocations": 1000
          },
          {
            "sample": 17,
            "phase": "warmup",
            "ms": 3.547790999999961,
            "heapDeltaBytes": 6988192,
            "checkedInvocations": 1000
          },
          {
            "sample": 18,
            "phase": "warmup",
            "ms": 4.053065000000004,
            "heapDeltaBytes": -9648600,
            "checkedInvocations": 1000
          },
          {
            "sample": 19,
            "phase": "warmup",
            "ms": 3.762186999999983,
            "heapDeltaBytes": 6988888,
            "checkedInvocations": 1000
          },
          {
            "sample": 20,
            "phase": "warmup",
            "ms": 3.5942300000000387,
            "heapDeltaBytes": 6989368,
            "checkedInvocations": 1000
          },
          {
            "sample": 21,
            "phase": "measured",
            "ms": 4.001929999999959,
            "heapDeltaBytes": -9726880,
            "checkedInvocations": 1000
          },
          {
            "sample": 22,
            "phase": "measured",
            "ms": 3.8653789999999617,
            "heapDeltaBytes": 6989272,
            "checkedInvocations": 1000
          },
          {
            "sample": 23,
            "phase": "measured",
            "ms": 3.675799999999981,
            "heapDeltaBytes": -9725008,
            "checkedInvocations": 1000
          },
          {
            "sample": 24,
            "phase": "measured",
            "ms": 13.14559300000002,
            "heapDeltaBytes": 6989184,
            "checkedInvocations": 1000
          },
          {
            "sample": 25,
            "phase": "measured",
            "ms": 3.9703630000000203,
            "heapDeltaBytes": -9681024,
            "checkedInvocations": 1000
          },
          {
            "sample": 26,
            "phase": "measured",
            "ms": 3.5726290000000063,
            "heapDeltaBytes": 6990424,
            "checkedInvocations": 1000
          },
          {
            "sample": 27,
            "phase": "measured",
            "ms": 3.609473000000037,
            "heapDeltaBytes": 6992056,
            "checkedInvocations": 1000
          },
          {
            "sample": 28,
            "phase": "measured",
            "ms": 3.70442300000002,
            "heapDeltaBytes": -9714000,
            "checkedInvocations": 1000
          },
          {
            "sample": 29,
            "phase": "measured",
            "ms": 3.3690089999999486,
            "heapDeltaBytes": 6988480,
            "checkedInvocations": 1000
          },
          {